<?xml version="1.0" encoding="UTF-8"?>
<!-- Avalex Display Configuration -->
<Plugins Group=""
	xmlns:xsi="http://www.w3.org/2001/XMLSchema-instance"
	xsi:noNamespaceSchemaLocation="../plugin.xsd">
	<Plugin Class="MonGeneric">
		<Param Name="Name" Type="STRING">GENERIC</Param>	<!-- Legacy entry that is not utilized at this time -->
		<Param Name="Description" Type="STRING">Standard NTSC Composite Monitor</Param>	<!-- Legacy entry that is not utilized at this time -->
		<Param Name="Display Profile" Type="ENUM">DIS_NTSC_CUSTOM</Param>
		<Param Name="Commanded State" Type="INTEGER">0</Param>	<!-- Legacy entry that is not utilized at this time -->
		<Param Name="Horizontal Numerator" Type="INTEGER">1</Param>	<!-- Legacy entry that is not utilized at this time -->
		<Param Name="Horizontal Denominator" Type="INTEGER">1</Param>	<!-- Legacy entry that is not utilized at this time -->
		<Param Name="Vertical Numerator" Type="INTEGER">1</Param>	<!-- Legacy entry that is not utilized at this time -->
		<Param Name="Vertical Denominator" Type="INTEGER">1</Param>	<!-- Legacy entry that is not utilized at this time -->
		<Param Name="Width" Type="INTEGER">720</Param>
		<Param Name="Height" Type="INTEGER">480</Param>
		<Param Name="D Mode" Type="ENUM">VPORT_MODE_BT656_8BIT</Param>	<!-- #define VPORT_MODE_BT656_8BIT		0x00000000 -->
		<Param Name="Fld Op" Type="ENUM">VPORT_FLDOP_FRAME</Param>		<!-- #define VPORT_FLDOP_FRAME			0x00000004 -->
		<Param Name="Frm HSize" Type="INTEGER">858</Param>
		<Param Name="Frm VSize" Type="INTEGER">525</Param>
		<Param Name="Img HOffset Fld 1" Type="INTEGER">0</Param>
		<Param Name="Img VOffset Fld 1" Type="INTEGER">0</Param>
		<Param Name="Img HSize Fld 1" Type="INTEGER">720</Param>
		<Param Name="Img VSize Fld 1" Type="INTEGER">240</Param>
		<Param Name="Img HOffset Fld 2" Type="INTEGER">0</Param>
		<Param Name="Img VOffset Fld 2" Type="INTEGER">0</Param>
		<Param Name="Img HSize Fld 2" Type="INTEGER">720</Param>
		<Param Name="Img VSize Fld 2" Type="INTEGER">240</Param>
		<Param Name="H Blnk Start" Type="INTEGER">720</Param>
		<Param Name="H Blnk Stop" Type="INTEGER">856</Param>
		<Param Name="V Blnk X Start Fld 1" Type="INTEGER">720</Param>
		<Param Name="V Blnk Y Start Fld 1" Type="INTEGER">1</Param>
		<Param Name="V Blnk X Stop Fld 1" Type="INTEGER">720</Param>
		<Param Name="V Blnk Y Stop Fld 1" Type="INTEGER">21</Param>
		<Param Name="V Blnk X Start Fld 2" Type="INTEGER">360</Param>
		<Param Name="V Blnk Y Start Fld 2" Type="INTEGER">263</Param>
		<Param Name="V Blnk X Stop Fld 2" Type="INTEGER">360</Param>
		<Param Name="V Blnk Y Stop Fld 2" Type="INTEGER">284</Param>
		<Param Name="X Start Fld 1" Type="INTEGER">720</Param>
		<Param Name="Y Start Fld 1" Type="INTEGER">1</Param>
		<Param Name="X Start Fld 2" Type="INTEGER">360</Param>
		<Param Name="Y Start Fld 2" Type="INTEGER">263</Param>
		<Param Name="H Sync Start" Type="INTEGER">736</Param>
		<Param Name="H Sync Stop" Type="INTEGER">800</Param>
		<Param Name="V Sync X Start Fld 1" Type="INTEGER">736</Param>
		<Param Name="V Sync Y Start Fld 1" Type="INTEGER">4</Param>
		<Param Name="V Sync X Stop Fld 1" Type="INTEGER">736</Param>
		<Param Name="V Sync Y Stop Fld 1" Type="INTEGER">7</Param>
		<Param Name="V Sync X Start Fld 2" Type="INTEGER">307</Param>
		<Param Name="V Sync Y Start Fld 2" Type="INTEGER">266</Param>
		<Param Name="V Sync X Stop Fld 2" Type="INTEGER">307</Param>
		<Param Name="V Sync Y Stop Fld 2" Type="INTEGER">269</Param>
	</Plugin>
</Plugins>

