<?xml version="1.0" encoding="UTF-8"?>
<!-- Plugin information -->
<Plugins Group=""
	xmlns:xsi="http://www.w3.org/2001/XMLSchema-instance"
	xsi:noNamespaceSchemaLocation="../plugin.xsd">


	<!--

      here are the video source ESAV supports
      Camera Front  - In7 - 0
      Camera Left   - In2 - 1
      Camera Right  - In3(8) - 2
      Camera Rear IR - In1 - 4
      Camera Rear Color - In10 - 5
       Camera DVD Player - In6 - 3
      Camera DCM Text   - In17 - 6
      Camera Observer   - In4(3) - 7      
	-->



	<Plugin Class="VideoSourceAggregate" ID="Camera Front">
		<Param Name="Server ID" Type="INTEGER">0</Param>
		<Param Name="Icon" Type="STRING">camera_frontcenter</Param>
		<Plugin Class="VideoSourceAnalogVdds" Filter="Client" ID="Analog Camera 0">
			<Include File="NTSC_GENERIC_Frame"/>
			<!--
			RGB1 In7
			-->
			<Param Name="Video Input Port" Type="INTEGER">7</Param>
		</Plugin>
		<Plugin Class="CmdCameraSelector">
			<Param Name="Up" Type="STRING">Camera Rear Color</Param>
			<Param Name="Down" Type="STRING">Camera Rear IR</Param>
			<Param Name="Left" Type="STRING">Camera Left</Param>
			<Param Name="Right" Type="STRING">Camera Right</Param>
		</Plugin>
	</Plugin>



	<Plugin Class="VideoSourceAggregate" ID="Camera Left">
		<Param Name="Server ID" Type="INTEGER">1</Param>
		<Param Name="Icon" Type="STRING">camera_frontleft</Param>
		<Plugin Class="VideoSourceAnalogVdds" Filter="Client" ID="Analog Camera 1">
			<!--
			RS170 In2
			-->
			<Include File="NTSC_GENERIC_Frame"/>
			<Param Name="Video Input Port" Type="INTEGER">2</Param>
		</Plugin>
		<Plugin Class="CmdCameraSelector">
			<Param Name="Up" Type="STRING">Camera Front</Param>
			<Param Name="Down" Type="STRING">Camera DVD Player</Param>
			<Param Name="Left" Type="STRING">Camera Left</Param>
			<Param Name="Right" Type="STRING">Camera Right</Param>
		</Plugin>
	</Plugin>



	<Plugin Class="VideoSourceAggregate" ID="Camera Right">
		<Param Name="Server ID" Type="INTEGER">2</Param>
		<Param Name="Icon" Type="STRING">camera_frontright</Param>
		<Plugin Class="VideoSourceAnalogVdds" Filter="Client" ID="Analog Camera 2">
			<!--
			RS170 In3
			-->
			<Include File="NTSC_GENERIC_Frame"/>
			<Param Name="Video Input Port" Type="INTEGER">8</Param>
		</Plugin>
		<Plugin Class="CmdCameraSelector">
			<Param Name="Up" Type="STRING">Camera Front</Param>
			<Param Name="Down" Type="STRING">Camera Rear Color</Param>
			<Param Name="Left" Type="STRING">Camera Left</Param>
			<Param Name="Right" Type="STRING">Camera DVD Player</Param>
		</Plugin>
	</Plugin>

	<Plugin Class="VideoSourceAggregate" ID="Camera DVD Player">
		<Param Name="Server ID" Type="INTEGER">3</Param>
		<Param Name="Icon" Type="STRING">camera_dvd</Param>
		<Plugin Class="VideoSourceAnalogVdds" Filter="Client" ID="Analog Camera 3">
			<!--
			RS170 In6
			-->
			<Include File="NTSC_GENERIC_Frame"/>
			<Param Name="Video Input Port" Type="INTEGER">6</Param>
		</Plugin>
		<Plugin Class="CmdCameraSelector">
			<Param Name="Up" Type="STRING">Camera Front</Param>
			<Param Name="Down" Type="STRING">Camera Rear Color</Param>
			<Param Name="Left" Type="STRING">Camera Left</Param>
			<Param Name="Right" Type="STRING">Camera DVD Player</Param>
		</Plugin>
	</Plugin>



	<Plugin Class="VideoSourceAggregate" ID="Camera Rear IR">
		<Param Name="Server ID" Type="INTEGER">4</Param>
		<Param Name="Icon" Type="STRING">camera_rear</Param>
		<Plugin Class="VideoSourceAnalogVdds" Filter="Client" ID="Analog Camera 4">
			<!--
			RS170 In1
			-->
			<Include File="NTSC_GENERIC_Frame"/>
			<Param Name="Video Input Port" Type="INTEGER">1</Param>
		</Plugin>
		<Plugin Class="CmdCameraSelector">
			<Param Name="Up" Type="STRING">Camera Front</Param>
			<Param Name="Down" Type="STRING">Camera Rear Color</Param>
			<Param Name="Left" Type="STRING">Camera Left</Param>
			<Param Name="Right" Type="STRING">Camera DVD Player</Param>
		</Plugin>
	</Plugin>



	<Plugin Class="VideoSourceAggregate" ID="Camera Rear Color">
		<Param Name="Server ID" Type="INTEGER">5</Param>
		<Param Name="Icon" Type="STRING">camera_rear</Param>
		<Plugin Class="VideoSourceAnalogVdds" Filter="Client" ID="Analog Camera 5">
			<!--
			RS170 In10
			-->
			<Include File="NTSC_GENERIC_Frame"/>
			<Param Name="Video Input Port" Type="INTEGER">10</Param>
		</Plugin>
		<Plugin Class="CmdCameraSelector">
			<Param Name="Up" Type="STRING">Camera Front</Param>
			<Param Name="Down" Type="STRING">Camera Rear Color</Param>
			<Param Name="Left" Type="STRING">Camera Left</Param>
			<Param Name="Right" Type="STRING">Camera DVD Player</Param>
		</Plugin>
	</Plugin>



	<Plugin Class="VideoSourceAggregate" ID="Camera DCM Text">
		<Param Name="Server ID" Type="INTEGER">6</Param>
		<Param Name="Icon" Type="STRING">camera_pc</Param>
		<Plugin Class="VideoSourceAnalogVdds" Filter="Client" ID="Analog Camera 6">
			<!--
			RS170 In5
			-->
			<Include File="RGB_XGA_60Hz"/>
			<Param Name="Video Input Port" Type="INTEGER">17</Param>
		</Plugin>
		<Plugin Class="CmdCameraSelector">
			<Param Name="Up" Type="STRING">Camera Front</Param>
			<Param Name="Down" Type="STRING">Camera Rear Color</Param>
			<Param Name="Left" Type="STRING">Camera Left</Param>
			<Param Name="Right" Type="STRING">Camera DVD Player</Param>
		</Plugin>
	</Plugin>



	<Plugin Class="VideoSourceAggregate" ID="Camera Observer">
		<Param Name="Server ID" Type="INTEGER">7</Param>
		<Param Name="Icon" Type="STRING">camera_observer</Param>
		<Plugin Class="VideoSourceAnalogVdds" Filter="Client" ID="Analog Camera 7">
			<!--
			RS170 In4
			-->
			<Include File="NTSC_GENERIC_Frame"/>
			<Param Name="Video Input Port" Type="INTEGER">3</Param>
		</Plugin>
		<Plugin Class="CmdCameraSelector">
			<Param Name="Up" Type="STRING">Camera Front</Param>
			<Param Name="Down" Type="STRING">Camera Rear Color</Param>
			<Param Name="Left" Type="STRING">Camera Left</Param>
			<Param Name="Right" Type="STRING">Camera DVD Player</Param>
		</Plugin>
		<Plugin Class="CamDveDiscrete" Filter="Client" ID="Client DVE Camera 0">
			<Param Name="DVE Input Port" Type="INTEGER">3</Param>
		</Plugin>
	</Plugin>
</Plugins>
