<?xml version="1.0" encoding="UTF-8"?>
<!-- Plugin information -->
<Plugins Group=""
	xmlns:xsi="http://www.w3.org/2001/XMLSchema-instance"
	xsi:noNamespaceSchemaLocation="../plugin.xsd">
	<Plugin Class="InputUk3HeadCtd10" ID="Touch Screen 0">
      		<Param Name="Display Port" Type="INTEGER">1</Param>
		<Param Name="Port" Type="STRING">/dev/tts/1</Param>
		<Param Name="Baud" Type="INTEGER">9600</Param>
		<Param Name="Parity" Type="STRING">None</Param>
		<Param Name="Stop Bits" Type="INTEGER">1</Param>
		<Param Name="Data Bits" Type="INTEGER">8</Param>
		<Param Name="Flow Control" Type="STRING">None</Param>

	     	<Param Name="CAN Used" Type="INTEGER">1</Param>
	     	<Param Name="CAN Port" Type="STRING">/dev/can1</Param>
	      	<Param Name="CAN Port Num" Type="INTEGER">2</Param>
	      <!--CAN Port Num is 1 based -->
	     	<Param Name="Display Port 2" Type="INTEGER">2</Param>
	     	<Param Name="Display Port 3" Type="INTEGER">3</Param>
	      	<Param Name="CAN Baud Rate" Type="INTEGER">250</Param>
	      	<Param Name="Termination" Type="INTEGER">1</Param>

	</Plugin>
</Plugins>
