<?xml version="1.0" encoding="UTF-8"?>
<!-- Plugin information -->
<Plugins Group=""
	xmlns:xsi="http://www.w3.org/2001/XMLSchema-instance"
	xsi:noNamespaceSchemaLocation="../plugin.xsd">
	<Plugin Class="InputSerialPassThruBiDirectionalVDDS" ID="CM - EPTM">

		<Plugin Class="CommSerialPassThruBiDirectionalVDDS" ID="RS485">
			<!-- CM  - 485 serial port configuration-->
			<Param Name="Port1" Type="STRING">/dev/ttyVDDS17080</Param>
			<Param Name="Baud1" Type="INTEGER">19200</Param>
			<Param Name="Parity1" Type="STRING">None</Param>
			<Param Name="Stop Bits1" Type="INTEGER">1</Param>
			<Param Name="Data Bits1" Type="INTEGER">8</Param>
			<Param Name="Flow Control1" Type="STRING">None</Param>

			<!-- EPTM - 485 serial port configuration -->
			<Param Name="Port2" Type="STRING">/dev/ttyVDDS4850</Param>
			<Param Name="Baud2" Type="INTEGER">19200</Param>
			<Param Name="Parity2" Type="STRING">None</Param>
			<Param Name="Stop Bits2" Type="INTEGER">1</Param>
			<Param Name="Data Bits2" Type="INTEGER">8</Param>
			<Param Name="Flow Control2" Type="STRING">None</Param>
		</Plugin>
	</Plugin>


	<Plugin Class="InputGdcCfpd10" ID="GDC CFPD 10">
		<!-- Avalex touch screen input device -->
		<Plugin Class="CommSerialVDDS" ID="RS-422 1">
			<!--IDataStream plugin -->
			<Param Name="Port" Type="STRING">/dev/ttyVDDS0</Param>
			<Param Name="Baud" Type="INTEGER">9600</Param>
			<Param Name="Parity" Type="STRING">None</Param>
			<Param Name="Stop Bits" Type="INTEGER">1</Param>
			<Param Name="Data Bits" Type="INTEGER">8</Param>
			<Param Name="Flow Control" Type="STRING">None</Param>
			<Param Name="Non Blocking" Type="BOOL">false</Param>
		</Plugin>
		<Plugin Class="MsgGdcCfpd10" ID="GdcCfpd10 Msg 0">
			<!--IDataLink plugin -->
		</Plugin>
		<Plugin Class="EventGraphicsVDDS" ID="Graphic Events 0">
			<!--IGraphicsEvent plugin -->
		</Plugin>
		<Plugin Class="CmdVcb" ID="Menu Light 0">
			<!--CmdVcb plugin -->
		</Plugin>
	</Plugin>


</Plugins>
