<?xml version="1.0" encoding="UTF-8"?>
<!-- Plugin information -->
<Plugins Group=""
	xmlns:xsi="http://www.w3.org/2001/XMLSchema-instance"
	xsi:noNamespaceSchemaLocation="../plugin.xsd">
	<Plugin Class="InputUkCdtVDDS" ID="VCB 0">
		<!-- Avalex touch screen input device -->
		<Plugin Class="CommSerialVDDS" ID="RS-232 0">
			<!--IDataStream plugin -->
			<Param Name="Port" Type="STRING">/dev/ttyVDDS0</Param>
			<Param Name="Baud" Type="INTEGER">9600</Param>
			<Param Name="Parity" Type="STRING">None</Param>
			<Param Name="Stop Bits" Type="INTEGER">1</Param>
			<Param Name="Data Bits" Type="INTEGER">8</Param>
			<Param Name="Flow Control" Type="STRING">None</Param>
		</Plugin>
		<Plugin Class="MsgVcb" ID="Vcb Msg 0">
			<!--IDataLink plugin -->
		</Plugin>
		<Plugin Class="EventGraphicsVDDS" ID="Graphic Events 0">
			<!--IGraphicsEvent plugin -->
		</Plugin>
		<Plugin Class="CmdVcb" ID="Menu Light 0">
			<!--CmdVcb plugin -->
		</Plugin>
	</Plugin>
</Plugins>
